epNum,airDate,extra_info,round_name,coord,category,order,value,daily_double,question,answer,correctAttempts,wrongAttempts
63,1984-12-05,,Jeopardy,"(4, 2)",LAKES & RIVERS,6,"(200,)",False,The end of a river that empties into a lake or ocean,the mouth,1,1
63,1984-12-05,,Jeopardy,"(6, 2)",HATS,14,"(200,)",False,Slang for a construction worker,a hardhat,1,0
63,1984-12-05,,Jeopardy,"(1, 3)",FIRST LADIES,3,"(300,)",False,Virginia Governor Charles Robb's mother-in-law,Lady Bird Johnson,1,0
63,1984-12-05,,Jeopardy,"(2, 3)",SPORTS,19,"(800,)",True,These 2 former Olympic athletes became movie Tarzans,Buster Crabbe and Johnny Weissmuller,1,0
63,1984-12-05,,Jeopardy,"(3, 3)",FOREIGN CUISINE,11,"(300,)",False,A small Oriental orange or a division of Chinese cuisine,Mandarin,1,0
63,1984-12-05,,Jeopardy,"(4, 3)",LAKES & RIVERS,20,"(300,)",False,Sam Rayburn Reservoir is this state's largest lake,Texas,1,0
63,1984-12-05,,Jeopardy,"(6, 3)",HATS,15,"(300,)",False,'50s fuzzy frontier fad,a Davy Crockett coonskin hat,1,0
63,1984-12-05,,Jeopardy,"(1, 4)",FIRST LADIES,4,"(400,)",False,"In '62 Adlai Stevenson eulogized: ""She would rather light candles than curse the darkness""",Eleanor Roosevelt,1,0
63,1984-12-05,,Jeopardy,"(2, 4)",SPORTS,23,"(400,)",False,He shouts the commands in crew racing,coxswain,1,0
63,1984-12-05,,Jeopardy,"(3, 4)",FOREIGN CUISINE,12,"(400,)",False,City Wiener Schnitzel is named for,Vienna,1,1
63,1984-12-05,,Jeopardy,"(4, 4)",LAKES & RIVERS,21,"(400,)",False,"Located in Oregon, it's the deepest lake in North America",Crater Lake,1,1
63,1984-12-05,,Jeopardy,"(6, 4)",HATS,17,"(400,)",False,"Graduate's cap, it sounds like a plasterer's tool",a mortarboard,1,2
63,1984-12-05,,Jeopardy,"(1, 5)",FIRST LADIES,16,"(500,)",False,Only wife of 1 president & mother of another,Abigail Adams,1,0
63,1984-12-05,,Jeopardy,"(4, 5)",LAKES & RIVERS,22,"(500,)",False,"Either of 2 Marilyn Monroe films with ""watery"" titles",(1 of) Niagara and the River of No Return,0,3
63,1984-12-05,,Double Jeopardy,"(1, 1)",ZOOLOGY,1,"(200,)",False,"Finned on fish, scaly on lizards, nonexistent on humans & manx cats",tails,1,1
63,1984-12-05,,Double Jeopardy,"(2, 1)",EUROPE,11,"(200,)",False,"""The Eternal City""",Rome,1,0
63,1984-12-05,,Double Jeopardy,"(3, 1)",RELIGION,9,"(200,)",False,"In 1978, this pope reigned for only 34 days",Pope John Paul I,1,0
63,1984-12-05,,Double Jeopardy,"(4, 1)",MATHEMATICS,4,"(200,)",False,Number of degrees in a circle,360,1,0
63,1984-12-05,,Double Jeopardy,"(5, 1)",U.S. HISTORY,19,"(200,)",False,The 1st permanent English settlement in America,Jamestown,1,0
63,1984-12-05,,Double Jeopardy,"(6, 1)",HOTEL NAMES,5,"(200,)",False,Liz's Nicky,Hilton,1,1
63,1984-12-05,,Double Jeopardy,"(1, 2)",ZOOLOGY,2,"(400,)",False,"From Latin ""to gnaw"", there are more of this group than all other mammals combined",rodents,1,0
63,1984-12-05,,Double Jeopardy,"(2, 2)",EUROPE,12,"(400,)",False,"Hitler said this Polish capital ""must cease to exist; level it""",Warsaw,1,0
63,1984-12-05,,Double Jeopardy,"(3, 2)",RELIGION,23,"(400,)",False,Colonial Maryland was founded as haven for members of this church,the (Roman) Catholic Church,1,0
63,1984-12-05,,Double Jeopardy,"(4, 2)",MATHEMATICS,8,"(400,)",False,Mathematical function people in the Bible were always going forth & doing,multiplying,1,1
63,1984-12-05,,Double Jeopardy,"(5, 2)",U.S. HISTORY,20,"(400,)",False,"""Reconstruction"" was the 13-year period following this",the Civil War,1,0
63,1984-12-05,,Double Jeopardy,"(6, 2)",HOTEL NAMES,6,"(400,)",False,The film in which Bing sang about a white Christmas & an Easter parade,Holiday Inn,1,0
63,1984-12-05,,Double Jeopardy,"(1, 3)",ZOOLOGY,3,"(600,)",False,"In mammals, trait determined by presence or absence of Y-chromosome",sex,1,1
63,1984-12-05,,Double Jeopardy,"(2, 3)",EUROPE,13,"(600,)",False,Moscow park that was scene of murders investigated in recent best-seller & film,Gorky Park,1,0
63,1984-12-05,,Double Jeopardy,"(4, 3)",MATHEMATICS,10,"(600,)",False,Logarithmic tool outmoded by the calculator,a slide rule,1,0
63,1984-12-05,,Double Jeopardy,"(5, 3)",U.S. HISTORY,21,"(600,)",False,Only U.S. civilians ever executed in America for espionage,Julius and Ethel Rosenberg,1,0
63,1984-12-05,,Double Jeopardy,"(6, 3)",HOTEL NAMES,7,"(600,)",False,"According to Andy Griffith, ""Everything's good that sits on"" this cracker",a Ritz,1,0
63,1984-12-05,,Double Jeopardy,"(2, 4)",EUROPE,14,"(800,)",False,"Since 300 A.D., this region of N.E. France has been traded 7 times by Germany and France",Alsace-Lorraine,1,0
63,1984-12-05,,Double Jeopardy,"(4, 4)",MATHEMATICS,17,"(800,)",False,Total meters in a hectometer,100,0,3
63,1984-12-05,,Double Jeopardy,"(6, 4)",HOTEL NAMES,16,"(800,)",False,"In 1959, ""Maverick"" won the Emmy for this category, only year it was given",Best Western,1,1
63,1984-12-05,,Double Jeopardy,"(2, 5)",EUROPE,15,"(1000,)",False,Bavarian village famous for its passion play,Oberammergau,0,3
63,1984-12-05,,Double Jeopardy,"(4, 5)",MATHEMATICS,18,"(1000,)",False,The formula for its volume is V equals pi r²h,a cylinder,0,3
63,1984-12-05,,Double Jeopardy,"(6, 5)",HOTEL NAMES,22,"(1300,)",True,Muppets commenting from the balcony in the following,Statler and Waldorf,0,1
63,1984-12-05,,Final Jeopardy,"(1, 1)",SHOW BUSINESS,0,"(2300, 2650)",False,"Barrymore, Rathbone, Roger Moore & Larry Hagman are among 61 actors to play this character",Sherlock Holmes,1,1
68,1984-12-12,Ric Moser game 4.,Jeopardy,"(1, 1)",INVENTIONS,13,"(100,)",False,"""Fulton's Folly""",a steamboat,1,0
68,1984-12-12,Ric Moser game 4.,Jeopardy,"(2, 1)",ANCIENT WORLDS,12,"(100,)",False,Where all roads were supposed to have led,Rome,1,0
68,1984-12-12,Ric Moser game 4.,Jeopardy,"(3, 1)",HOLLYWOOD LEGENDS,1,"(100,)",False,Brando was 2 when his mom appeared on stage with this dad of Peter & Jane,Henry Fonda,1,0
68,1984-12-12,Ric Moser game 4.,Jeopardy,"(4, 1)",CARS,5,"(100,)",False,Daimler & Benz borrowed this name from a friend's daughter,Mercedes,1,0
68,1984-12-12,Ric Moser game 4.,Jeopardy,"(5, 1)",U.S. STATES,19,"(100,)",False,The Empire State,New York,1,0
68,1984-12-12,Ric Moser game 4.,Jeopardy,"(6, 1)","""HARD""",2,"(100,)",False,Fermented apple juice,hard cider,1,0
68,1984-12-12,Ric Moser game 4.,Jeopardy,"(1, 2)",INVENTIONS,14,"(200,)",False,"Early ones were called the ""hobby horse"", ""penny-farthing"" & ""high-wheeler""",a bicycle,1,0
68,1984-12-12,Ric Moser game 4.,Jeopardy,"(2, 2)",ANCIENT WORLDS,15,"(200,)",False,"Its people called it ""kemet"", color of black, from land after flooding by Nile",Egypt,1,0
68,1984-12-12,Ric Moser game 4.,Jeopardy,"(3, 2)",HOLLYWOOD LEGENDS,6,"(200,)",False,She won 8 Academy Awards with only her clothes appearing on screen,Edith Head,1,0
68,1984-12-12,Ric Moser game 4.,Jeopardy,"(4, 2)",CARS,10,"(200,)",False,GM car named for Indian chief who tried to take Ft. Detroit,Pontiac,1,0
68,1984-12-12,Ric Moser game 4.,Jeopardy,"(5, 2)",U.S. STATES,20,"(200,)",False,The ceiling of its capitol features a lone star,Texas,1,0
68,1984-12-12,Ric Moser game 4.,Jeopardy,"(6, 2)","""HARD""",3,"(200,)",False,"Descriptive of Mike Hammer, Private Eye, or a 20-minute egg",hard-boiled,1,0
68,1984-12-12,Ric Moser game 4.,Jeopardy,"(1, 3)",INVENTIONS,23,"(300,)",False,1899 device for attaching papers that can ruin a computer disc when magnetized,a paper clip,1,1
68,1984-12-12,Ric Moser game 4.,Jeopardy,"(2, 3)",ANCIENT WORLDS,16,"(300,)",False,Followed the Stone Age; named for copper alloy people used for tools & weapons,the Bronze Age,1,0
68,1984-12-12,Ric Moser game 4.,Jeopardy,"(3, 3)",HOLLYWOOD LEGENDS,7,"(500,)",True,"The 3 stars of ""Rebel Without a Cause"" who met with untimely deaths","Natalie Wood, James Dean, and Sal Mineo",0,1
68,1984-12-12,Ric Moser game 4.,Jeopardy,"(4, 3)",CARS,11,"(300,)",False,What BMW stands for,Bavarian Motor Works,1,0
68,1984-12-12,Ric Moser game 4.,Jeopardy,"(5, 3)",U.S. STATES,21,"(300,)",False,"Only U.S. state with a ""Z"" in its name",Arizona,1,0
68,1984-12-12,Ric Moser game 4.,Jeopardy,"(6, 3)","""HARD""",4,"(300,)",False,Reason people used to stick a trumpet in their ear,hard of hearing,1,0
68,1984-12-12,Ric Moser game 4.,Jeopardy,"(1, 4)",INVENTIONS,27,"(400,)",False,"After inventing the lever & pulley, this Greek said, ""I will move the Earth""",Archimedes,1,1
68,1984-12-12,Ric Moser game 4.,Jeopardy,"(2, 4)",ANCIENT WORLDS,17,"(400,)",False,The Chinese once regarded calligraphy as a branch of this art,painting,1,0
68,1984-12-12,Ric Moser game 4.,Jeopardy,"(3, 4)",HOLLYWOOD LEGENDS,8,"(400,)",False,"In her 1st film she sang with ""Alfalfa"" Switzer; in her next, she was paired with Lassie",Elizabeth Taylor,0,3
68,1984-12-12,Ric Moser game 4.,Jeopardy,"(5, 4)",U.S. STATES,22,"(400,)",False,The New England state without an Atlantic Ocean coastline,Vermont,1,0
68,1984-12-12,Ric Moser game 4.,Jeopardy,"(6, 4)","""HARD""",24,"(400,)",False,TV role Brian Keith judged OK to play,Hardcastle,1,0
68,1984-12-12,Ric Moser game 4.,Jeopardy,"(1, 5)",INVENTIONS,28,"(500,)",False,"1st one to attempt sinking a warship was the ""Turtle"" in the Revolutionary War",a submarine,1,1
68,1984-12-12,Ric Moser game 4.,Jeopardy,"(2, 5)",ANCIENT WORLDS,18,"(500,)",False,Civilization of sailors that developed 1st Western alphabet,the Phoenicians,1,0
68,1984-12-12,Ric Moser game 4.,Jeopardy,"(3, 5)",HOLLYWOOD LEGENDS,9,"(500,)",False,"Oliver Hardy's co-star in ""The Fighting Kentuckian""",John Wayne,1,0
68,1984-12-12,Ric Moser game 4.,Jeopardy,"(5, 5)",U.S. STATES,26,"(500,)",False,"8th state of the Union, it was the 1st state to secede",South Carolina,1,0
68,1984-12-12,Ric Moser game 4.,Jeopardy,"(6, 5)","""HARD""",25,"(500,)",False,"Album & film featuring ""Tell Me Why"" & ""You Can't Do That""",A Hard Day\'s Night,1,0
68,1984-12-12,Ric Moser game 4.,Double Jeopardy,"(1, 1)",BODIES OF WATER,10,"(200,)",False,"The Shannon River, longest in the British Isles, is in this country",Ireland,1,0
68,1984-12-12,Ric Moser game 4.,Double Jeopardy,"(2, 1)",NEWSPAPERS,8,"(200,)",False,Major New York daily that runs no comic strips,The New York Times,1,0
68,1984-12-12,Ric Moser game 4.,Double Jeopardy,"(3, 1)",CIVIL WARS,3,"(200,)",False,With India's help Bangladesh broke away from this country,Pakistan,1,0
68,1984-12-12,Ric Moser game 4.,Double Jeopardy,"(4, 1)",MUSICIANS,5,"(200,)",False,"Among his famous ""pianos"" have been his bed & swimming pool",Liberace,1,0
68,1984-12-12,Ric Moser game 4.,Double Jeopardy,"(5, 1)",DRUGS,7,"(200,)",False,Lysergic acid diethylamide,LSD,1,0
68,1984-12-12,Ric Moser game 4.,Double Jeopardy,"(6, 1)","""EASY""",1,"(200,)",False,Way you can have your eggs or Mary Martin,over easy,1,0
68,1984-12-12,Ric Moser game 4.,Double Jeopardy,"(1, 2)",BODIES OF WATER,21,"(400,)",False,"A bridge has been proposed to connect Long Island & Rhode Island, across this waterway",the Long Island Sound,1,1
68,1984-12-12,Ric Moser game 4.,Double Jeopardy,"(2, 2)",NEWSPAPERS,13,"(400,)",False,"Wash., D.C.'s 2nd largest paper, The Times, is published by members of this church",the Moonies (or the Unification Church),1,0
68,1984-12-12,Ric Moser game 4.,Double Jeopardy,"(3, 2)",CIVIL WARS,16,"(400,)",False,The Cavaliers opposed the close-cropped Roundheads in this country's civil war,England,1,1
68,1984-12-12,Ric Moser game 4.,Double Jeopardy,"(4, 2)",MUSICIANS,6,"(400,)",False,"In spite of ""koochie koochie"" image, she's an accomplished guitarist",Charo,1,0
68,1984-12-12,Ric Moser game 4.,Double Jeopardy,"(5, 2)",DRUGS,18,"(400,)",False,"In 1903, barbital became the 1st of this type of drug",barbiturates,1,0
68,1984-12-12,Ric Moser game 4.,Double Jeopardy,"(6, 2)","""EASY""",2,"(400,)",False,"Slang for parasitical hanger-on, or what Peter Fonda played in '69",easy rider,1,0
68,1984-12-12,Ric Moser game 4.,Double Jeopardy,"(2, 3)",NEWSPAPERS,14,"(600,)",False,"He now owns the New York Post, Village Voice, Boston Herald, Chicago Sun-Times & San Antonio Express",Rupert Murdoch,1,0
68,1984-12-12,Ric Moser game 4.,Double Jeopardy,"(3, 3)",CIVIL WARS,17,"(600,)",False,Its starving children symbolized the defeat of this Nigerian region,Biafra,1,0
68,1984-12-12,Ric Moser game 4.,Double Jeopardy,"(4, 3)",MUSICIANS,12,"(600,)",False,He succeeded Arthur Fiedler directing the Boston Pops,John Williams,1,1
68,1984-12-12,Ric Moser game 4.,Double Jeopardy,"(6, 3)","""EASY""",4,"(1200,)",True,"Keith Carradine's Oscar-winning song from the movie ""Nashville""","""I\'m Easy""",1,0
68,1984-12-12,Ric Moser game 4.,Double Jeopardy,"(2, 4)",NEWSPAPERS,15,"(800,)",False,Roaring '20s president who was a journalist by profession,Harding,1,0
68,1984-12-12,Ric Moser game 4.,Double Jeopardy,"(3, 4)",CIVIL WARS,20,"(800,)",False,Symbolic colors of opposing sides in Northern Ireland,green and orange,1,0
68,1984-12-12,Ric Moser game 4.,Double Jeopardy,"(4, 4)",MUSICIANS,22,"(1000,)",True,"Pioneer of multi-track recording, he was creator of popular Gibson solid-body guitar",Les Paul,0,1
68,1984-12-12,Ric Moser game 4.,Double Jeopardy,"(6, 4)","""EASY""",9,"(800,)",False,"Movie title which refers to a ""handful"" of etudes",Five Easy Pieces,1,1
68,1984-12-12,Ric Moser game 4.,Double Jeopardy,"(2, 5)",NEWSPAPERS,19,"(1000,)",False,"West Coast newspaper that owns Long Island's ""Newsday""",The Los Angeles Times,1,0
68,1984-12-12,Ric Moser game 4.,Double Jeopardy,"(3, 5)",CIVIL WARS,24,"(1000,)",False,Name of Franco's party in Spain & main Christian party in Lebanon,the Phalange,0,3
68,1984-12-12,Ric Moser game 4.,Double Jeopardy,"(4, 5)",MUSICIANS,23,"(1000,)",False,His brilliance on the violin might be explained by his unusual hand formation,Jascha Heifetz,1,1
68,1984-12-12,Ric Moser game 4.,Double Jeopardy,"(6, 5)","""EASY""",11,"(1000,)",False,"'30s domestic comedy radio show featuring Goodman Ace & wife, Jane",Easy Aces,1,0
68,1984-12-12,Ric Moser game 4.,Final Jeopardy,"(1, 1)",FLAGS,0,"(4600, 2499)",False,Country whose flag includes pictures of the British & Dutch flags,South Africa,0,2
1,1984-09-10,Premiere episode with Alex Trebek as host.,Jeopardy,"(1, 1)",LAKES & RIVERS,11,"(100,)",False,River mentioned most often in the Bible,the Jordan,1,1
1,1984-09-10,Premiere episode with Alex Trebek as host.,Jeopardy,"(2, 1)",INVENTIONS,13,"(100,)",False,Marconi's wonderful wireless,the radio,0,3
1,1984-09-10,Premiere episode with Alex Trebek as host.,Jeopardy,"(3, 1)",ANIMALS,1,"(100,)",False,These rodents first got to America by stowing away on ships,rats,1,0
1,1984-09-10,Premiere episode with Alex Trebek as host.,Jeopardy,"(4, 1)",FOREIGN CUISINE,20,"(100,)",False,"The ""coq"" in coq au vin",chicken,1,0
1,1984-09-10,Premiere episode with Alex Trebek as host.,Jeopardy,"(5, 1)",ACTORS & ROLES,3,"(100,)",False,Video in which Michael Jackson plays a werewolf & a zombie,"""Thriller""",1,0
1,1984-09-10,Premiere episode with Alex Trebek as host.,Jeopardy,"(1, 2)",LAKES & RIVERS,12,"(200,)",False,Scottish word for lake,loch,1,0
1,1984-09-10,Premiere episode with Alex Trebek as host.,Jeopardy,"(2, 2)",INVENTIONS,17,"(200,)",False,"In 1869 an American minister created this ""oriental"" transportation",the rickshaw,1,0
1,1984-09-10,Premiere episode with Alex Trebek as host.,Jeopardy,"(3, 2)",ANIMALS,2,"(200,)",False,"There are about 40,000 muscles & tendons in this part of an elephant's body",the trunk,1,0
1,1984-09-10,Premiere episode with Alex Trebek as host.,Jeopardy,"(4, 2)",FOREIGN CUISINE,21,"(200,)",False,"A British variety is called ""bangers"", a Mexican variety, ""chorizo""",sausages,1,0
1,1984-09-10,Premiere episode with Alex Trebek as host.,Jeopardy,"(5, 2)",ACTORS & ROLES,4,"(200,)",False,"2 ""Saturday Night"" alumni who tried ""Trading Places""",Dan Aykroyd & Eddie Murphy,1,0
1,1984-09-10,Premiere episode with Alex Trebek as host.,Jeopardy,"(1, 3)",LAKES & RIVERS,14,"(800,)",True,River in this famous song:,the Volga River,1,0
1,1984-09-10,Premiere episode with Alex Trebek as host.,Jeopardy,"(2, 3)",INVENTIONS,18,"(300,)",False,A 1920's hunting trip to Canada inspired Birdseye's food preserving method,freezing,1,0
1,1984-09-10,Premiere episode with Alex Trebek as host.,Jeopardy,"(3, 3)",ANIMALS,8,"(300,)",False,"When husbands ""pop"" for an ermine coat, they're actually buying this fur",a weasel,0,3
1,1984-09-10,Premiere episode with Alex Trebek as host.,Jeopardy,"(4, 3)",FOREIGN CUISINE,22,"(300,)",False,Jewish crepe filled with cheese,a blintz,1,0
1,1984-09-10,Premiere episode with Alex Trebek as host.,Jeopardy,"(5, 3)",ACTORS & ROLES,5,"(300,)",False,"He may ""Never Say Never Again"" when asked to be Bond",Sean Connery,1,0
1,1984-09-10,Premiere episode with Alex Trebek as host.,Jeopardy,"(1, 4)",LAKES & RIVERS,15,"(400,)",False,American river only 33 miles shorter than the Mississippi,the Missouri,1,0
1,1984-09-10,Premiere episode with Alex Trebek as host.,Jeopardy,"(2, 4)",INVENTIONS,19,"(400,)",False,This fastener gets its name from a brand of galoshes it was used on,a zipper,0,3
1,1984-09-10,Premiere episode with Alex Trebek as host.,Jeopardy,"(3, 4)",ANIMALS,9,"(400,)",False,"Close relative of the pig, though its name means ""river horse""",the hippopotamus,1,0
1,1984-09-10,Premiere episode with Alex Trebek as host.,Jeopardy,"(4, 4)",FOREIGN CUISINE,23,"(400,)",False,French for a toothsome cut of beef served to a twosome,Châteaubriand,1,0
1,1984-09-10,Premiere episode with Alex Trebek as host.,Jeopardy,"(5, 4)",ACTORS & ROLES,6,"(400,)",False,"The blonde preferred in the film ""Gentlemen Prefer Blondes""",Marilyn Monroe,1,0
1,1984-09-10,Premiere episode with Alex Trebek as host.,Jeopardy,"(1, 5)",LAKES & RIVERS,16,"(500,)",False,"World's largest lake, nearly 5 times as big as Superior",the Caspian Sea,1,0
1,1984-09-10,Premiere episode with Alex Trebek as host.,Jeopardy,"(3, 5)",ANIMALS,10,"(500,)",False,"If this species of hybrid's parents were reversed, you'd get a hinny",mule,1,0
1,1984-09-10,Premiere episode with Alex Trebek as host.,Jeopardy,"(5, 5)",ACTORS & ROLES,7,"(500,)",False,"Sam Shepard played this barrier breaker in ""The Right Stuff""",Colonel Chuck Yeager,1,1
1,1984-09-10,Premiere episode with Alex Trebek as host.,Double Jeopardy,"(1, 1)",THE BIBLE,6,"(200,)",False,"When ""Joshua Fit The Battle Of Jericho"", these took a tumble",the walls,1,0
1,1984-09-10,Premiere episode with Alex Trebek as host.,Double Jeopardy,"(2, 1)",'50'S TV,9,"(200,)",False,"Occupation of Richard Diamond, Peter Gunn & Mike Hammer",private eyes (or private detectives),1,0
1,1984-09-10,Premiere episode with Alex Trebek as host.,Double Jeopardy,"(3, 1)",NATIONAL LANDMARKS,8,"(200,)",False,She came from France to harbor America's freedom,the Statue of Liberty,1,0
1,1984-09-10,Premiere episode with Alex Trebek as host.,Double Jeopardy,"(5, 1)",NOTORIOUS,21,"(200,)",False,"It was probably a lyre, not a fiddle, if he played it while Rome burned",Nero,1,0
1,1984-09-10,Premiere episode with Alex Trebek as host.,Double Jeopardy,"(6, 1)",4-LETTER WORDS,1,"(200,)",False,Pulled the trigger or what's in a jigger,shot,1,1
1,1984-09-10,Premiere episode with Alex Trebek as host.,Double Jeopardy,"(1, 2)",THE BIBLE,7,"(400,)",False,His price was 30 pieces of silver,Judas,1,1
1,1984-09-10,Premiere episode with Alex Trebek as host.,Double Jeopardy,"(2, 2)",'50'S TV,10,"(400,)",False,"She was ""Our Miss Brooks""",Eve Arden,1,0
1,1984-09-10,Premiere episode with Alex Trebek as host.,Double Jeopardy,"(3, 2)",NATIONAL LANDMARKS,16,"(400,)",False,"When he was home, George Washington slept here",Mount Vernon,1,0
1,1984-09-10,Premiere episode with Alex Trebek as host.,Double Jeopardy,"(5, 2)",NOTORIOUS,22,"(400,)",False,"His book, translated as ""My Struggle"", outlined plans to conquer Europe",Adolf Hitler,1,0
1,1984-09-10,Premiere episode with Alex Trebek as host.,Double Jeopardy,"(6, 2)",4-LETTER WORDS,2,"(400,)",False,Basketball defense or Serling's twilight area,zone,1,0
1,1984-09-10,Premiere episode with Alex Trebek as host.,Double Jeopardy,"(1, 3)",THE BIBLE,13,"(600,)",False,"According to the Bible, it wasn't necessarily an apple",the forbidden fruit (or the fruit of the Tree of Knowledge),1,0
1,1984-09-10,Premiere episode with Alex Trebek as host.,Double Jeopardy,"(2, 3)",'50'S TV,11,"(600,)",False,Amount Michael Anthony gave out each week on behalf of John Beresford Tipton,$1 million,1,0
1,1984-09-10,Premiere episode with Alex Trebek as host.,Double Jeopardy,"(3, 3)",NATIONAL LANDMARKS,20,"(600,)",False,"The cornerstone of Massachusetts, it bears the date 1620",Plymouth Rock,1,0
1,1984-09-10,Premiere episode with Alex Trebek as host.,Double Jeopardy,"(5, 3)",NOTORIOUS,23,"(600,)",False,"Lenin called him ruthless, and his purges proved he was",Stalin,1,0
1,1984-09-10,Premiere episode with Alex Trebek as host.,Double Jeopardy,"(6, 3)",4-LETTER WORDS,3,"(600,)",False,"Little girls do it with a rope, Van Halen does it in a song",jump,1,0
1,1984-09-10,Premiere episode with Alex Trebek as host.,Double Jeopardy,"(1, 4)",THE BIBLE,14,"(800,)",False,"Though its name means ""city of peace"", it's seen over 30 wars, the last in 1967",Jerusalem,1,0
1,1984-09-10,Premiere episode with Alex Trebek as host.,Double Jeopardy,"(2, 4)",'50'S TV,12,"(800,)",False,"His card read ""Have gun, will travel""",Paladin (Richard Boone),1,1
1,1984-09-10,Premiere episode with Alex Trebek as host.,Double Jeopardy,"(3, 4)",NATIONAL LANDMARKS,19,"(800,)",False,"Site where John Hancock signed his ""John Hancock""",Independence Hall,1,1
1,1984-09-10,Premiere episode with Alex Trebek as host.,Double Jeopardy,"(6, 4)",4-LETTER WORDS,4,"(1000,)",True,"It's the first 4-letter word in ""The Star Spangled Banner""",what,1,0
1,1984-09-10,Premiere episode with Alex Trebek as host.,Double Jeopardy,"(1, 5)",THE BIBLE,15,"(1000,)",False,"According to 1st Timothy, it is the ""root of all evil""",the love of money,1,0
1,1984-09-10,Premiere episode with Alex Trebek as host.,Double Jeopardy,"(2, 5)",'50'S TV,18,"(1000,)",False,Name under which experimenter Don Herbert taught viewers all about science,Mr. Wizard,1,0
1,1984-09-10,Premiere episode with Alex Trebek as host.,Double Jeopardy,"(3, 5)",NATIONAL LANDMARKS,17,"(1000,)",False,D.C. building shaken by November '83 bomb blast,the Capitol,1,2
1,1984-09-10,Premiere episode with Alex Trebek as host.,Double Jeopardy,"(5, 5)",NOTORIOUS,24,"(1000,)",False,"After the deed, he leaped to the stage shouting ""Sic semper tyrannis""",John Wilkes Booth,1,0
1,1984-09-10,Premiere episode with Alex Trebek as host.,Double Jeopardy,"(6, 5)",4-LETTER WORDS,5,"(1000,)",False,The president takes one before stepping into office,oath,1,0
1,1984-09-10,Premiere episode with Alex Trebek as host.,Final Jeopardy,"(1, 1)",HOLIDAYS,0,"(2500, 3700, 300)",False,The third Monday of January starting in 1986,Martin Luther King Day,3,0
21,1984-10-08,,Jeopardy,"(1, 1)",THE '40S,18,"(100,)",False,"In '45, a U.S. bomber crashed into this N.Y. landmark's 79th floor",the Empire State Building,1,0
21,1984-10-08,,Jeopardy,"(2, 1)",BOATS,13,"(100,)",False,Venice's taxis,gondolas,1,0
21,1984-10-08,,Jeopardy,"(3, 1)",BALLET,4,"(100,)",False,"Part of body used to dance on ""pointe""",toe,1,0
21,1984-10-08,,Jeopardy,"(4, 1)","""MARCH"" ON",14,"(100,)",False,Definitely not Caesar's time of month,the ides of March,1,0
21,1984-10-08,,Jeopardy,"(5, 1)",JAPAN,21,"(100,)",False,Raw fish dish,sushi,1,0
21,1984-10-08,,Jeopardy,"(6, 1)",TV TRIVIA,11,"(100,)",False,"Jim Henson coined this word from a combination of ""marionette"" & ""puppet""",muppet,1,0
21,1984-10-08,,Jeopardy,"(1, 2)",THE '40S,19,"(200,)",False,Rudy Vallee recorded it in '31 & Sam played it again in Casablanca,"""As Time Goes By""",1,0
21,1984-10-08,,Jeopardy,"(2, 2)",BOATS,3,"(200,)",False,A small boat used to move big boats,tug,1,0
21,1984-10-08,,Jeopardy,"(3, 2)",BALLET,6,"(200,)",False,Tchaikovsky's fowl aquatic ballet,"""Swan Lake""",1,0
21,1984-10-08,,Jeopardy,"(4, 2)","""MARCH"" ON",16,"(200,)",False,"Founded by F.D.R. in 1938, it works to prevent birth defects",the March of Dimes,1,0
21,1984-10-08,,Jeopardy,"(6, 2)",TV TRIVIA,1,"(200,)",False,David Janssen's private eye with the last name Orwell,Harry O,1,0
21,1984-10-08,,Jeopardy,"(1, 3)",THE '40S,20,"(300,)",False,Body builder Charles Atlas offered to build up the physique of this Indian leader,Mahatma Gandhi,0,3
21,1984-10-08,,Jeopardy,"(2, 3)",BOATS,12,"(300,)",False,"A flat-bottomed boat propelled by a pole, or a 4th down football play",punt,1,0
21,1984-10-08,,Jeopardy,"(3, 3)",BALLET,7,"(300,)",False,"New York City Ballet's ""Mr. B.""",George Balanchine,1,0
21,1984-10-08,,Jeopardy,"(4, 3)","""MARCH"" ON",17,"(300,)",False,"Way of saying ""loony as a spring rabbit""",mad as a March hare,0,3
21,1984-10-08,,Jeopardy,"(5, 3)",JAPAN,15,"(300,)",False,"Known originally for motorcycles, this Japanese company now operates an auto plant in Ohio",Honda,1,0
21,1984-10-08,,Jeopardy,"(6, 3)",TV TRIVIA,2,"(300,)",False,Yancy's fancy pistol,derringer,1,0
21,1984-10-08,,Jeopardy,"(1, 4)",THE '40S,24,"(400,)",False,"German for ""lightning war""",blitzkrieg,1,0
21,1984-10-08,,Jeopardy,"(3, 4)",BALLET,8,"(400,)",False,The arrangement of dance movements,choreography,1,0
21,1984-10-08,,Jeopardy,"(5, 4)",JAPAN,22,"(400,)",False,The ancient art of paper folding,origami,1,1
21,1984-10-08,,Jeopardy,"(6, 4)",TV TRIVIA,5,"(400,)",False,Cook Graham Kerr was known as this,The Galloping Gourmet,1,0
21,1984-10-08,,Jeopardy,"(3, 5)",BALLET,9,"(500,)",False,Formerly England's Sadler's Wells Ballet,the Royal Ballet,0,3
21,1984-10-08,,Jeopardy,"(5, 5)",JAPAN,23,"(500,)",False,"Western name for towering tsunamis, clocked at up to 500 MPH",tidal waves,0,3
21,1984-10-08,,Jeopardy,"(6, 5)",TV TRIVIA,10,"(500,)",False,"From the Swahili word for ""doctor"", the show featured a cross-eyed lion",Daktari,1,1
