epNum,airDate,extra_info,round_name,coord,category,order,value,daily_double,question,answer,correctAttempts,wrongAttempts
20,1984-10-05,Elise Beraru game 5.,Double Jeopardy,"(1, 5)",CLASSICAL MUSIC,10,"(1000,)",False,"On radio he was the ""maestro"" of the NBC Symphony Orchestra",Arturo Toscanini,1,0
20,1984-10-05,Elise Beraru game 5.,Double Jeopardy,"(2, 5)",POLITICS,17,"(1000,)",False,"3rd party, its presidential candidates included Eugene Debs & Norman Thomas",Socialist,1,0
20,1984-10-05,Elise Beraru game 5.,Double Jeopardy,"(3, 5)",FAMOUS QUOTES,18,"(2000,)",True,"Whittier wrote, ""For all sad words of tongue or pen, the saddest are these""",it might have been,1,0
20,1984-10-05,Elise Beraru game 5.,Double Jeopardy,"(5, 5)",SPORTS SHIFTS,1,"(1000,)",False,"Under cover of darkness, they left Baltimore for Indianapolis",the Colts,1,0
20,1984-10-05,Elise Beraru game 5.,Double Jeopardy,"(6, 5)",LANGUAGE,15,"(1000,)",False,The only Romance language from an East Bloc country,Romanian,1,0
20,1984-10-05,Elise Beraru game 5.,Final Jeopardy,"(1, 1)",WORLD GEOGRAPHY,0,"(700, 501, 6600)",False,It has more people than all the other South American countries combined,Brazil,2,1
127,1985-03-05,Bruce Fauman game 4.,Jeopardy,"(1, 1)",WILD WEST,10,"(100,)",False,He killed 21 men & was himself killed at age 21,Billy the Kid,1,1
127,1985-03-05,Bruce Fauman game 4.,Jeopardy,"(2, 1)",FOODS,1,"(100,)",False,"From Dutch meaning ""cabbage salad"", that's just what it is",cole slaw,1,0
127,1985-03-05,Bruce Fauman game 4.,Jeopardy,"(3, 1)",ZOOLOGY,16,"(100,)",False,"On television, it ""roars"" for MTM",a pussycat,1,1
127,1985-03-05,Bruce Fauman game 4.,Jeopardy,"(4, 1)",TRAVEL & TOURISM,12,"(100,)",False,"Many motorists prefer to stay in these ""B&B"" places",bed & breakfasts,1,0
127,1985-03-05,Bruce Fauman game 4.,Jeopardy,"(5, 1)",TELEVISION,5,"(100,)",False,"What the initials stand for in ""E/R""",emergency room,1,0
127,1985-03-05,Bruce Fauman game 4.,Jeopardy,"(6, 1)",SUDDEN DEATH,22,"(100,)",False,Every August 23rd a woman in black leaves flowers on this silent star's resting place,Valentino,1,0
127,1985-03-05,Bruce Fauman game 4.,Jeopardy,"(1, 2)",WILD WEST,11,"(200,)",False,"Slang word for cowboy, from Spanish ""vaquero""",buckaroo,0,3
127,1985-03-05,Bruce Fauman game 4.,Jeopardy,"(2, 2)",FOODS,2,"(200,)",False,These flaming French pancakes originally caught fire by accident,Crêpes Suzette,1,0
127,1985-03-05,Bruce Fauman game 4.,Jeopardy,"(3, 2)",ZOOLOGY,17,"(200,)",False,"The largest anthropoid apes, they eat meat only in captivity",gorillas,1,0
127,1985-03-05,Bruce Fauman game 4.,Jeopardy,"(4, 2)",TRAVEL & TOURISM,13,"(200,)",False,"The real name of the ""Love Boat""",the Pacific Princess,1,0
127,1985-03-05,Bruce Fauman game 4.,Jeopardy,"(5, 2)",TELEVISION,6,"(200,)",False,"When Tony Musante dropped out of ""Toma"", Universal signed Robert Blake & developed this show",Beretta,1,0
127,1985-03-05,Bruce Fauman game 4.,Jeopardy,"(6, 2)",SUDDEN DEATH,23,"(200,)",False,More suicides occur on this day than any other day of the week,Monday,1,0
127,1985-03-05,Bruce Fauman game 4.,Jeopardy,"(2, 3)",FOODS,3,"(300,)",False,"""Nautical"" legume broth, served daily in the U.S. Senate cafeteria",Navy bean soup,1,0
127,1985-03-05,Bruce Fauman game 4.,Jeopardy,"(3, 3)",ZOOLOGY,18,"(300,)",False,Longest-lived vertebrate animal,the tortoise,0,3
127,1985-03-05,Bruce Fauman game 4.,Jeopardy,"(4, 3)",TRAVEL & TOURISM,14,"(300,)",False,"Hebrew for ""mountain fortress"", its ruinous site of last Jewish holdout against the Romans",Masada,1,0
127,1985-03-05,Bruce Fauman game 4.,Jeopardy,"(5, 3)",TELEVISION,8,"(300,)",False,Carl Sagan's saga,Cosmos,1,1
127,1985-03-05,Bruce Fauman game 4.,Jeopardy,"(6, 3)",SUDDEN DEATH,24,"(900,)",True,(AUDIO DAILY DOUBLE):Life-threatening condition in the following:(My mouth is dry / My legs are weak / I'm thinkin' this 'cause I can't speak),heart attack,0,1
127,1985-03-05,Bruce Fauman game 4.,Jeopardy,"(2, 4)",FOODS,4,"(400,)",False,18th C. English Earl who always had meat between bread brought to the gambling tables,Earl of Sandwich,1,0
127,1985-03-05,Bruce Fauman game 4.,Jeopardy,"(3, 4)",ZOOLOGY,20,"(400,)",False,Branch of zoology that deals with birds,ornithology,1,0
127,1985-03-05,Bruce Fauman game 4.,Jeopardy,"(4, 4)",TRAVEL & TOURISM,15,"(400,)",False,"The country in which you find the famous ""Spanish Steps""",Italy,1,0
127,1985-03-05,Bruce Fauman game 4.,Jeopardy,"(5, 4)",TELEVISION,9,"(400,)",False,"""The Tonight Show"" was just called ""Tonight!"" when he was its host",Steve Allen,1,0
127,1985-03-05,Bruce Fauman game 4.,Jeopardy,"(2, 5)",FOODS,7,"(500,)",False,The food & drink of the gods which bestowed youth & immortality,nectar & ambrosia,1,2
127,1985-03-05,Bruce Fauman game 4.,Jeopardy,"(4, 5)",TRAVEL & TOURISM,19,"(500,)",False,"What you do to a ""fado"" in Portugal","sing it, or dance to it",1,1
127,1985-03-05,Bruce Fauman game 4.,Jeopardy,"(5, 5)",TELEVISION,21,"(500,)",False,"He plays a Hill on ""Hill Street Blues""",Michael Warren,1,1
127,1985-03-05,Bruce Fauman game 4.,Double Jeopardy,"(1, 1)",CLASSICAL MUSIC,7,"(200,)",False,"Simply, the leader of the band or orchestra",the conductor,1,0
127,1985-03-05,Bruce Fauman game 4.,Double Jeopardy,"(2, 1)",RELIGION,20,"(200,)",False,Mountain upon which Moses received the 10 Commandments,Sinai,1,0
127,1985-03-05,Bruce Fauman game 4.,Double Jeopardy,"(3, 1)","STARTS WITH ""L""",17,"(200,)",False,The one of two evils you should pick,the lesser,1,0
127,1985-03-05,Bruce Fauman game 4.,Double Jeopardy,"(4, 1)",COLLEGES,6,"(200,)",False,"""Ramblin' Wrecks"" hail from there but their team's the ""Yellow Jackets""",Georgia Tech,1,0
127,1985-03-05,Bruce Fauman game 4.,Double Jeopardy,"(5, 1)",FRENCH REVOLUTION,12,"(200,)",False,Dickens' novel set against backdrop of the revolution,A Tale of Two Cities,1,0
127,1985-03-05,Bruce Fauman game 4.,Double Jeopardy,"(6, 1)",MOVIE TRIVIA,4,"(200,)",False,"For ""6 Weeks"", she had a love affair with Dudley Moore",Mary Tyler Moore,1,0
127,1985-03-05,Bruce Fauman game 4.,Double Jeopardy,"(1, 2)",CLASSICAL MUSIC,8,"(400,)",False,"Marx Brothers film featuring a performance of ""Il Trovatore""",A Night at the Opera,1,0
127,1985-03-05,Bruce Fauman game 4.,Double Jeopardy,"(2, 2)",RELIGION,21,"(400,)",False,"Norwegian Protestant football coach, he became a Catholic at Notre Dame",Knute Rockne,1,0
127,1985-03-05,Bruce Fauman game 4.,Double Jeopardy,"(3, 2)","STARTS WITH ""L""",18,"(400,)",False,A body of water surrounded by land,a lake,1,0
127,1985-03-05,Bruce Fauman game 4.,Double Jeopardy,"(4, 2)",COLLEGES,5,"(400,)",False,Alabama univ. founded by Booker T. Washington,Tuskegee Institute,1,1
127,1985-03-05,Bruce Fauman game 4.,Double Jeopardy,"(5, 2)",FRENCH REVOLUTION,13,"(400,)",False,"She was falsely accused of saying ""Let them eat cake"" when told the people had no bread",Marie Antoinette,1,0
127,1985-03-05,Bruce Fauman game 4.,Double Jeopardy,"(6, 2)",MOVIE TRIVIA,23,"(400,)",False,"To get a ride in ""It Happened One Night"", this proved mightier than Gable's thumb",Claudette Colbert\'s leg,1,0
127,1985-03-05,Bruce Fauman game 4.,Double Jeopardy,"(1, 3)",CLASSICAL MUSIC,9,"(600,)",False,"5'4"", thickset & broad, he wrote the Appassionata Sonata which broke the classic rules",Ludvig von Beethoven,0,3
127,1985-03-05,Bruce Fauman game 4.,Double Jeopardy,"(2, 3)",RELIGION,22,"(600,)",False,"Of three main branches of Judaism, the one founded in Germany",Reform,0,3
127,1985-03-05,Bruce Fauman game 4.,Double Jeopardy,"(3, 3)","STARTS WITH ""L""",19,"(2500,)",True,Judge Roy Bean named a Texas town for this Gay '90s British actress,Lily Langtree,0,1
127,1985-03-05,Bruce Fauman game 4.,Double Jeopardy,"(4, 3)",COLLEGES,1,"(600,)",False,"In 1966, Yale invited this Poughkeepsie, NY women's school to merge with it",Vassar,1,0
127,1985-03-05,Bruce Fauman game 4.,Double Jeopardy,"(5, 3)",FRENCH REVOLUTION,14,"(600,)",False,French Revolution began when legislators took an oath at this type of court,tennis court,0,3
127,1985-03-05,Bruce Fauman game 4.,Double Jeopardy,"(1, 4)",CLASSICAL MUSIC,10,"(800,)",False,"""The Clock"", ""Drum Roll"" & ""Surprise"" symphonies are among over 100 composed by this Austrian",(Franz Josef) Haydn,1,0
127,1985-03-05,Bruce Fauman game 4.,Double Jeopardy,"(4, 4)",COLLEGES,2,"(800,)",False,"The University of Miami is in Florida, while Miami University is in this state",Ohio,1,1
127,1985-03-05,Bruce Fauman game 4.,Double Jeopardy,"(5, 4)",FRENCH REVOLUTION,15,"(800,)",False,"""The Committee of Public Safety"" carried out this most violent phase of the revolution",the Reign of Terror,1,0
127,1985-03-05,Bruce Fauman game 4.,Double Jeopardy,"(1, 5)",CLASSICAL MUSIC,11,"(1000,)",False,"Italian for ""joke"", it's the sprightly humorous movement of a sonata or symphony",a scherzo,0,3
127,1985-03-05,Bruce Fauman game 4.,Double Jeopardy,"(4, 5)",COLLEGES,3,"(1000,)",False,"Gallaudet College in Washington, D.C. is especially geared to this type of student",a deaf student,1,0
127,1985-03-05,Bruce Fauman game 4.,Double Jeopardy,"(5, 5)",FRENCH REVOLUTION,16,"(1000,)",True,"Like Darwin's ""fittest"", Talleyrand, when asked what he did during Rev., supposedly said this","""I survived"".",1,0
127,1985-03-05,Bruce Fauman game 4.,Final Jeopardy,"(1, 1)",BODIES OF WATER,0,"(799, 2299)",False,Only Great Lake not forming part of Michigan's borders,Lake Ontario,2,0
141,1985-03-25,Steve Rogitz game 2.,Jeopardy,"(1, 1)",EASY MATH,17,"(100,)",False,The answer to 65 divided by 4/7 x 0,zero,1,0
141,1985-03-25,Steve Rogitz game 2.,Jeopardy,"(2, 1)",FOOD FACTS,1,"(100,)",False,"The average adult male needs 3000 a day, a female, 2200",calories,1,0
141,1985-03-25,Steve Rogitz game 2.,Jeopardy,"(3, 1)","QUOTE, UNQUOTE",4,"(100,)",False,"Play in which Queen Gertrude, while watching a play, says, ""The lady doth protest too much""",Hamlet,1,2
141,1985-03-25,Steve Rogitz game 2.,Jeopardy,"(4, 1)",EGYPT,5,"(100,)",False,"Egyptian-born actor Michael Shalhoub, his most famous role was a Russian doctor",Omar Sharif,1,0
141,1985-03-25,Steve Rogitz game 2.,Jeopardy,"(5, 1)",CRIME & PUNISHMENT,14,"(100,)",False,"In California, this auto necessity is made at Folsom Prison",license plates,1,0
141,1985-03-25,Steve Rogitz game 2.,Jeopardy,"(1, 2)",EASY MATH,18,"(200,)",False,Number of first-class stamps in a $20 roll,a hundred,1,0
141,1985-03-25,Steve Rogitz game 2.,Jeopardy,"(2, 2)",FOOD FACTS,2,"(200,)",False,"Though leader in total world food production at 35%, this continent has 59% of the world's population",Asia,1,0
141,1985-03-25,Steve Rogitz game 2.,Jeopardy,"(3, 2)","QUOTE, UNQUOTE",8,"(200,)",False,"At the 1st Battle of Bull Run, Bernard Bee said, ""There is Jackson, standing like..."" this",a stone wall,1,0
141,1985-03-25,Steve Rogitz game 2.,Jeopardy,"(4, 2)",EGYPT,6,"(500,)",True,Italian opera set in Egypt featuring this march:,Aida,1,0
141,1985-03-25,Steve Rogitz game 2.,Jeopardy,"(5, 2)",CRIME & PUNISHMENT,15,"(200,)",False,"They were 1st trained to help with police work about 1900 in Ghent, Belgium",dogs,1,1
141,1985-03-25,Steve Rogitz game 2.,Jeopardy,"(1, 3)",EASY MATH,19,"(300,)",False,Decimal equivalent of 3/4,.75,1,0
141,1985-03-25,Steve Rogitz game 2.,Jeopardy,"(2, 3)",FOOD FACTS,3,"(300,)",False,"This process does not ""heal"" food, but preserves it",curing,0,3
141,1985-03-25,Steve Rogitz game 2.,Jeopardy,"(3, 3)","QUOTE, UNQUOTE",9,"(300,)",False,"Pop artist who claimed ""in the future everyone will be famous for 15 minutes""",Andy Warhol,1,0
141,1985-03-25,Steve Rogitz game 2.,Jeopardy,"(4, 3)",EGYPT,7,"(300,)",False,Leader assassinated at parade celebrating 8th anniversary of Yom Kippur War,Sadat,1,0
141,1985-03-25,Steve Rogitz game 2.,Jeopardy,"(5, 3)",CRIME & PUNISHMENT,16,"(300,)",False,"It's estimated there are about 40,000 separate police agencies in this country",the United States,1,1
141,1985-03-25,Steve Rogitz game 2.,Jeopardy,"(1, 4)",EASY MATH,20,"(400,)",False,"Sum of the 3 Billy Goats Gruff, the 3 Little Pigs & Goldilocks & the 3 Bears",10,1,0
141,1985-03-25,Steve Rogitz game 2.,Jeopardy,"(2, 4)",FOOD FACTS,12,"(400,)",False,Paris cooking school named after ribbons worn by the Order of the Holy Ghost,Cordon Bleu,1,0
141,1985-03-25,Steve Rogitz game 2.,Jeopardy,"(3, 4)","QUOTE, UNQUOTE",10,"(400,)",False,"""I can't mate in captivity."" explained this feminist on why she's never married",Gloria Steinem,1,0
141,1985-03-25,Steve Rogitz game 2.,Jeopardy,"(4, 4)",EGYPT,22,"(400,)",False,Albanian founder of the last Egyptian dynasty; his namesake is a famous prizefighter,Muhammad Ali,1,1
141,1985-03-25,Steve Rogitz game 2.,Jeopardy,"(1, 5)",EASY MATH,21,"(500,)",False,The square root of 225,15,1,0
141,1985-03-25,Steve Rogitz game 2.,Jeopardy,"(2, 5)",FOOD FACTS,13,"(500,)",False,Colorful term used to describe effort to increase food production in developing countries,the green revolution,0,3
141,1985-03-25,Steve Rogitz game 2.,Jeopardy,"(3, 5)","QUOTE, UNQUOTE",11,"(500,)",False,"Completes the saying ""The trouble with a kitten is that...""",it grows to a cat,1,1
141,1985-03-25,Steve Rogitz game 2.,Jeopardy,"(5, 5)",CRIME & PUNISHMENT,23,"(500,)",False,A 43-year old mother of 4 recently broke up a $3.5 billion ring dealing in this drug,cocaine,1,0
141,1985-03-25,Steve Rogitz game 2.,Double Jeopardy,"(1, 1)",PRESIDENTS,1,"(200,)",False,"'70s president who, as a model, once appeared in ""Look"" magazine",Gerald Ford,1,1
141,1985-03-25,Steve Rogitz game 2.,Double Jeopardy,"(2, 1)",ROCKS & MINERALS,22,"(200,)",False,A sparking rock or a Michigan city,Flint,1,0
141,1985-03-25,Steve Rogitz game 2.,Double Jeopardy,"(3, 1)",MOVIE TRIVIA,3,"(200,)",False,"It was known as the dingus, the stuff dreams are made of & the black bird",the Maltese Falcon,1,1
141,1985-03-25,Steve Rogitz game 2.,Double Jeopardy,"(4, 1)",SOCIAL STUDIES,18,"(200,)",False,"3-letter term for fashions that come & go quickly, such as hula hoops & coonskin caps",a fad,1,0
141,1985-03-25,Steve Rogitz game 2.,Double Jeopardy,"(5, 1)",MAMMALS,2,"(200,)",False,"""Vampire"" variety of these actually do feed on the blood of other animals",bats,1,0
141,1985-03-25,Steve Rogitz game 2.,Double Jeopardy,"(6, 1)",AMERICAN LITERATURE,8,"(200,)",False,"Sport defined by Hemingway as ""Death in the Afternoon""",bullfighting,1,0
141,1985-03-25,Steve Rogitz game 2.,Double Jeopardy,"(1, 2)",PRESIDENTS,14,"(400,)",False,This office remained vacant during Truman's 1st administration,the vice-presidency,1,0
141,1985-03-25,Steve Rogitz game 2.,Double Jeopardy,"(3, 2)",MOVIE TRIVIA,4,"(400,)",False,Character from American history played on screen more than any other,Abe Lincoln,1,0
141,1985-03-25,Steve Rogitz game 2.,Double Jeopardy,"(4, 2)",SOCIAL STUDIES,19,"(400,)",False,"""Jus soli"", the right of soil, makes you this in the country of your birth",a citizen,1,0
141,1985-03-25,Steve Rogitz game 2.,Double Jeopardy,"(5, 2)",MAMMALS,15,"(400,)",False,"General name for the wild rabbits of Canada, the U.S. & Mexico; Peter is one",a cottontail,1,0
141,1985-03-25,Steve Rogitz game 2.,Double Jeopardy,"(6, 2)",AMERICAN LITERATURE,9,"(400,)",False,"In 1843, the Merriams took over the rights to his dictionary",Webster,1,0
141,1985-03-25,Steve Rogitz game 2.,Double Jeopardy,"(1, 3)",PRESIDENTS,16,"(600,)",False,"Said he could either run the country or control his daughter Alice, ""But not both""",Teddy Roosevelt,1,0
141,1985-03-25,Steve Rogitz game 2.,Double Jeopardy,"(3, 3)",MOVIE TRIVIA,5,"(600,)",False,"A sequel's now being planned to this top grossing film, called in France ""S.O.S. Phantomes""",Ghostbusters,0,3
141,1985-03-25,Steve Rogitz game 2.,Double Jeopardy,"(4, 3)",SOCIAL STUDIES,20,"(600,)",False,"Not a radioactive clan, but the core group of one's relatives",the nuclear family,0,3
141,1985-03-25,Steve Rogitz game 2.,Double Jeopardy,"(5, 3)",MAMMALS,24,"(600,)",False,"Before hunting, a pack of these meets & howls to keep other packs from its territory",wolves,1,0
141,1985-03-25,Steve Rogitz game 2.,Double Jeopardy,"(6, 3)",AMERICAN LITERATURE,10,"(600,)",False,"Her ""Giant"" grew into an epic movie",Edna Ferber,1,0
141,1985-03-25,Steve Rogitz game 2.,Double Jeopardy,"(1, 4)",PRESIDENTS,17,"(800,)",False,"Probably our most scholarly president, he was only one to earn a Ph.D.",Woodrow Wilson,1,0
141,1985-03-25,Steve Rogitz game 2.,Double Jeopardy,"(3, 4)",MOVIE TRIVIA,6,"(800,)",False,"To protect his image, Buster Keaton's MGM contract did not allow him to do this onscreen",smile,1,0
141,1985-03-25,Steve Rogitz game 2.,Double Jeopardy,"(4, 4)",SOCIAL STUDIES,21,"(800,)",False,U.S. equivalent to the bourgeoisie which developed between the aristocrats & the peasants in France,business class or middle class (merchant class accepted),1,0
141,1985-03-25,Steve Rogitz game 2.,Double Jeopardy,"(5, 4)",MAMMALS,25,"(800,)",False,"This swimming African animal ""yawns"" as an aggressive gesture before it attacks",a hippo,1,2
141,1985-03-25,Steve Rogitz game 2.,Double Jeopardy,"(6, 4)",AMERICAN LITERATURE,11,"(800,)",False,"""Death Comes for"" him Willa Cather's classic",the Archbishop,0,3
141,1985-03-25,Steve Rogitz game 2.,Double Jeopardy,"(1, 5)",PRESIDENTS,12,"(1000,)",False,"In 1940, FDR beat him to win 3rd term",Wendell Willkie,1,0
141,1985-03-25,Steve Rogitz game 2.,Double Jeopardy,"(3, 5)",MOVIE TRIVIA,7,"(1500,)",True,"4-generation film family which includes a knighted actor, his father, daughters & grandchildren",the Redgraves,1,0
141,1985-03-25,Steve Rogitz game 2.,Double Jeopardy,"(4, 5)",SOCIAL STUDIES,23,"(1000,)",False,It's suffered by one who goes from his simple society to a very complex one,culture shock,1,0
141,1985-03-25,Steve Rogitz game 2.,Double Jeopardy,"(6, 5)",AMERICAN LITERATURE,13,"(1000,)",False,"Novelist & poet who went ""Trout Fishing in America""",(Richard) Brautigan,1,0
141,1985-03-25,Steve Rogitz game 2.,Final Jeopardy,"(1, 1)",BUSINESS & INDUSTRY,0,"(2500, 4000)",False,This cereal co. which owns Parker Bros. & Lionel Trains is the largest toy maker in the world,General Mills,2,0
70,1984-12-14,,Jeopardy,"(1, 1)",U.S. CITIES,1,"(100,)",False,Alaskan city renamed this because ships docked there,Anchorage,1,0
70,1984-12-14,,Jeopardy,"(2, 1)",TIME,8,"(100,)",False,Watch named for the vibrating crystal that runs it,quartz,0,3
70,1984-12-14,,Jeopardy,"(3, 1)",DINING OUT,6,"(100,)",False,"Shortened from French meaning ""master of hotel"", he greets you & seats you",maitre d\',1,0
70,1984-12-14,,Jeopardy,"(4, 1)",CHILDREN'S LITERATURE,20,"(100,)",False,"Little girl who called ""Sunnybrook Farm"" home",Rebecca,1,0
70,1984-12-14,,Jeopardy,"(5, 1)",TRIVIA,10,"(100,)",False,The order of works in a dictionary,alphabetic,1,0
70,1984-12-14,,Jeopardy,"(6, 1)","""AC""/""DC""",12,"(100,)",False,"For this perennial teen-ager, life's been one big ""Bandstand""",Dick Clark,1,0
70,1984-12-14,,Jeopardy,"(1, 2)",U.S. CITIES,2,"(200,)",False,"Colorado city whose name means ""town"" in Spanish",Pueblo,1,0
70,1984-12-14,,Jeopardy,"(2, 2)",TIME,9,"(200,)",False,"It ""comes in like a lion & goes out like a lamb""",March,1,0
70,1984-12-14,,Jeopardy,"(3, 2)",DINING OUT,7,"(200,)",False,"If employed by Greyhound their motto might be ""Leave the clearing to us""",busboys,1,1
70,1984-12-14,,Jeopardy,"(4, 2)",CHILDREN'S LITERATURE,21,"(200,)",False,Hans Brinker's were silver,ice skates,1,0
70,1984-12-14,,Jeopardy,"(5, 2)",TRIVIA,11,"(200,)",False,Party symbol 1st used by Andrew Jackson after opponents called him a jackass,donkey,1,1
70,1984-12-14,,Jeopardy,"(6, 2)","""AC""/""DC""",15,"(200,)",False,"He's the master of ""Masterpiece Theater""",Alistair Cooke,1,1
70,1984-12-14,,Jeopardy,"(1, 3)",U.S. CITIES,3,"(300,)",False,The city of Niagara Falls is its largest suburb,Buffalo,1,0
70,1984-12-14,,Jeopardy,"(2, 3)",TIME,13,"(300,)",False,Number of months with exactly 30 days,4,1,1
70,1984-12-14,,Jeopardy,"(3, 3)",DINING OUT,24,"(300,)",False,"In Italian it's the course ordered ""before the meal""",antipasto,1,1
70,1984-12-14,,Jeopardy,"(4, 3)",CHILDREN'S LITERATURE,22,"(300,)",False,"As it called, it chanted, ""I think I can, I think I can""",The Little Engine,1,0
70,1984-12-14,,Jeopardy,"(6, 3)","""AC""/""DC""",16,"(300,)",False,She's the mother of Cary Grant's only child,Dyan Cannon,1,0
70,1984-12-14,,Jeopardy,"(1, 4)",U.S. CITIES,4,"(400,)",False,"Known for manufacturing grain silos, it's North Dakota's largest city",Fargo,0,3
70,1984-12-14,,Jeopardy,"(2, 4)",TIME,14,"(400,)",False,"Lucky children born that day are ""fair & wise & good & gay""",Sunday,0,3
70,1984-12-14,,Jeopardy,"(3, 4)",DINING OUT,25,"(400,)",False,"As sommelier, he hopes to ply you with the finest vintage",wine steward,1,1
70,1984-12-14,,Jeopardy,"(4, 4)",CHILDREN'S LITERATURE,23,"(400,)",False,Enid Bagnold's book that became Liz Taylor's 1st starring vehicle,National Velvet,1,1
70,1984-12-14,,Jeopardy,"(6, 4)","""AC""/""DC""",17,"(400,)",False,American sculptor known for his playful metal mobiles,Alexander Calder,0,3
70,1984-12-14,,Jeopardy,"(1, 5)",U.S. CITIES,5,"(500,)",True,"""Hub of the high plains"" Mac Davis saw it in his rearview mirror","Lubbock, Texas",0,1
70,1984-12-14,,Jeopardy,"(2, 5)",TIME,19,"(500,)",False,"Repeating group of days whose name means ""a turning"" in Old Norse",week,1,0
70,1984-12-14,,Jeopardy,"(6, 5)","""AC""/""DC""",18,"(500,)",False,"Born Vincent Furnier, this flamboyant singer ""welcomed us to his nightmare"" in '75",Alice Cooper,0,3
70,1984-12-14,,Double Jeopardy,"(1, 1)",GOV'T & POLITICS,6,"(200,)",False,"Major political party founded in Ripon, Wisconsin in 1854",Republicans,1,0
70,1984-12-14,,Double Jeopardy,"(2, 1)",THE BIBLE,19,"(200,)",False,"The Bible says he was swallowed by a ""great fish"", not a whale",Jonah,1,0
70,1984-12-14,,Double Jeopardy,"(3, 1)",WORLD WAR I,11,"(200,)",False,"He shot down 80 aircraft, but now plagues only Snoopy",The Red Baron,1,0
70,1984-12-14,,Double Jeopardy,"(4, 1)",FOREIGN PHRASES,16,"(200,)",False,"On an Italian map you might find ""tutte le strade conducono a Roma""",all roads lead to Rome,0,3
70,1984-12-14,,Double Jeopardy,"(5, 1)",ART,20,"(200,)",False,Color you get from mixing orange & black,brown (burnt orange accepted),1,2
70,1984-12-14,,Double Jeopardy,"(6, 1)",SINGERS & DANCERS,1,"(200,)",False,"Marine Jahan ""Flashdanced"" as her double",Jennifer Beals,0,3
70,1984-12-14,,Double Jeopardy,"(1, 2)",GOV'T & POLITICS,7,"(400,)",False,"If Puerto Rico becomes a state, this house of Congress will be enlarged",the Senate,1,0
70,1984-12-14,,Double Jeopardy,"(2, 2)",THE BIBLE,21,"(400,)",False,1st queen mentioned in the Bible was this royal visitor of Solomon,Queen of Sheba,1,0
70,1984-12-14,,Double Jeopardy,"(3, 2)",WORLD WAR I,12,"(400,)",False,Side Italy & Japan were on in World War I,Allies,1,0
70,1984-12-14,,Double Jeopardy,"(4, 2)",FOREIGN PHRASES,17,"(400,)",False,Gourmet cooking in France,haute cuisine,1,0
70,1984-12-14,,Double Jeopardy,"(6, 2)",SINGERS & DANCERS,2,"(400,)",False,"Nancy, Mia, then Barbara & now ""L.A. is his lady""",Frank Sinatra,1,0
70,1984-12-14,,Double Jeopardy,"(1, 3)",GOV'T & POLITICS,8,"(600,)",False,Doctrine by which state can take private property for public use,eminent domain,1,0
70,1984-12-14,,Double Jeopardy,"(2, 3)",THE BIBLE,23,"(600,)",False,It warned the last Babylonian king of his approaching doom,handwriting on the wall,0,3
70,1984-12-14,,Double Jeopardy,"(3, 3)",WORLD WAR I,13,"(600,)",False,"While this country was fighting war, a revolution broke out there",Russia,1,0
70,1984-12-14,,Double Jeopardy,"(4, 3)",FOREIGN PHRASES,18,"(600,)",False,"You can leave 'em in Germany with ""wer zuletzt lacht, lacht am besten""",He laughs best who laughs last,0,3
70,1984-12-14,,Double Jeopardy,"(6, 3)",SINGERS & DANCERS,3,"(600,)",False,"She keeps the kids from ""Fame"" on their toes",Debbie Allen,1,0
70,1984-12-14,,Double Jeopardy,"(1, 4)",GOV'T & POLITICS,9,"(800,)",False,In 1979 Shirley Hufstedler became 1st secretary of this cabinet department,Education,1,1
70,1984-12-14,,Double Jeopardy,"(3, 4)",WORLD WAR I,14,"(800,)",False,"The liner ""Lusitania"" flew the flag of this country",England (Great Britain),1,1
70,1984-12-14,,Double Jeopardy,"(4, 4)",FOREIGN PHRASES,22,"(800,)",False,"Latin title of Henryk Sienkiewicz novel, it means ""Where are you going?""",Quo Vadis,0,3
70,1984-12-14,,Double Jeopardy,"(5, 4)",ART,24,"(800,)",False,"Appointed court painter to Philip IV of Spain, he painted one of the few nudes in Spanish art",Velazquez,0,3
70,1984-12-14,,Double Jeopardy,"(6, 4)",SINGERS & DANCERS,4,"(800,)",False,Rob Reiner's rockers who've gone from reel to real,Spinal Tap,1,0
70,1984-12-14,,Double Jeopardy,"(1, 5)",GOV'T & POLITICS,10,"(1000,)",False,1st woman elected state governor who did not succeed her husband,Ella Grasso,1,0
70,1984-12-14,,Double Jeopardy,"(3, 5)",WORLD WAR I,15,"(1000,)",False,The war-ending armistice was signed in one of these,railway car,0,3
70,1984-12-14,,Double Jeopardy,"(6, 5)",SINGERS & DANCERS,5,"(1000,)",False,"In 1943 she created & staged the dances for the play ""Oklahoma!""",Agnes De Mille,0,3
70,1984-12-14,,Final Jeopardy,"(1, 1)",BUSINESS & INDUSTRY,0,"(295, 1200)",False,"Cincinnati company that is #1 TV advertiser, spending $½ billion per yr.",Procter & Gamble,0,2
2,1984-09-11,Second episode. Three-way tie at zero.,Jeopardy,"(1, 1)",STATE CAPITALS,6,"(100,)",False,Until 1875 its dual capitals were New Haven & Hartford,Connecticut,1,1
2,1984-09-11,Second episode. Three-way tie at zero.,Jeopardy,"(2, 1)",THE '40'S,1,"(100,)",False,"Though faster than a speeding bullet, he was ruled 4-F",Superman,1,0
2,1984-09-11,Second episode. Three-way tie at zero.,Jeopardy,"(4, 1)",TRANSPORTATION,11,"(100,)",False,"Type of auto engine, or a tomato cocktail",V8,0,3
